filename_img;filename_ots;filename_ann;text_ots;text_ann
Balinese_1.png;balinese_1_ots.txt;balinese_1_ann.txt;Lasun suba truna wusti apane bi-- sa berdikari.;"Lanun suba truna musti apang bi- sa ""“berdikari.”"""
i_bagus_caratan1.png;i_bagus_caratan1.ots.txt;i_bagus_caratan1.ann.txt;tan kapatut baan prabhu Siwa Budha;tan kapatut baan prabhu Siwa Budha
leak_pemoroan1.png;leak_pemoroan1.ots.txt;leak_pemoroan1.ann.txt;"Man, ada roko jarum? pitakene dabdab. ""Ada beli, niki napi. saur i dagang banban.";"""Man, ada roko jarum?” pitakéné dabdab, ""Ada beli, niki napi,” saur i dagang banban."
Balinese_2.png;balinese_2_ots.txt;balinese_2_ann.txt;Pangawi senior Ketut Rida embas ring Banjar Kanginan,;Pangawi senior Ketut Rida embas ring Banjar Kanginan,
i_bagus_caratan2.png;i_bagus_caratan2.ots.txt;i_bagus_caratan2.ann.txt;! Sapahati matatu rahat jemanien barak mwah wilis;I Sapahati matatu rahat jemanten barak mwah wilis
leak_pemoroan2.png;leak_pemoroan2.ots.txt;leak_pemoroan2.ann.txt;padagingan atur fityang i ratu aturin tityang mamargegt adyapin tyang manungkul;padagingan atur tityang i ratu aturin tityang mamarggi adyapin tyang manungkul
Balinese_3.png;balinese_3_ots.txt;balinese_3_ann.txt;Bapa meli carik aji 300 yuta rupiah.;Bapa meli carik aji 300 yuta rupiah.
i_bagus_caratan3.png;i_bagus_caratan3.ots.txt;i_bagus_caratan3.ann.txt;Murid-muride mamaca satua I Bawang teken I Kesuna.;Murid-muridé mamaca satua I Bawang tekén I Kesuna.
leak_pemoroan3.png;leak_pemoroan3.ots.txt;leak_pemoroan3.ann.txt;Bapa meli siap satus ukud.;Bapa meli siap satus ukud.
Balinese_4.png;balinese_4_ots.txt;balinese_4_ann.txt;hija ya lakuna? Mai ja walu:;kija ya lakuna? Mai ja malu!
i_bagus_caratan4.png;i_bagus_caratan4.ots.txt;i_bagus_caratan4.ann.txt;"I Darta : Lakar kija 'bojore' cne?""";"I Darta : “Lakar kija 'bojoge' ene?"""
leak_pemoroan4.png;leak_pemoroan4.ots.txt;leak_pemoroan4.ann.txt;kairasang di satwan Sing galangegala;kairasang di satwan Singgalanggala
Balinese_5.png;balinese_5_ots.txt;balinese_5_ann.txt;Sapunapi Akrostik ring puisi Bali Anyar? Pangawi puisi anyar wenten taler sida ngaripta puisi akrostik, nglimbakang saking akronim kruna utawi tetuwek.;Sapunapi Akrostik ring puisi Bali Anyar? Pangawi puisi anyar wénten taler sida ngaripta puisi akrostik, nglimbakang saking akronim kruna utawi tetuwek.
i_bagus_caratan5.png;i_bagus_caratan5.ots.txt;i_bagus_caratan5.ann.txt;Raden Aryya nape // kang banban maatur ratu dayane parakang;Raden Aryya nape // kang banban maatur ratu dayane parakang
leak_pemoroan5.png;leak_pemoroan5.ots.txt;leak_pemoroan5.ann.txt;hastil IDK Raka Kusuma;Rasti IDK Raka Kusuma
Balinese_6.png;balinese_6_ots.txt;balinese_6_ann.txt;Tiang sampun mamaca buku Katemu ring Tampaksiring.;Tiang sampun mamaca buku Katemu ring Tampaksiring.
i_bagus_caratan6.png;i_bagus_caratan6.ots.txt;i_bagus_caratan6.ann.txt;T Pelog luas maunincines nea. ba bekel nasi. |;I Belog luas mancing ngaba bekel nasi.
leak_pemoroan6.png;leak_pemoroan6.ots.txt;leak_pemoroan6.ann.txt;ento jani kawawonin katungkul punyah pakeweh tanidusin;ento jani kawawonin katungkul punyah pakeweh tanidusin
Balinese_7.png;balinese_7_ots.txt;balinese_7_ann.txt;Kebyanparan;Kebyahparan
i_bagus_caratan7.png;i_bagus_caratan7.ots.txt;i_bagus_caratan7.ann.txt;Satus tali rupiah pianake nagih pipis.;Satus tali rupiah pianaké nagih pipis.
leak_pemoroan7.png;leak_pemoroan7.ots.txt;leak_pemoroan7.ann.txt;Apa ke ento? kenkeun ke cue?;Apa ke ento? Kenken ke ene?
Balinese_8.png;balinese_8_ots.txt;balinese_8_ann.txt;"Eekawin *Roamayana* melah pesan. Akch sabe seneng rine buku ""ya- yaprana, *";"Lekawin ""Ramayana"" melah pesan. Akeh sane seneng ring buku ""Jaya- prana."""
i_bagus_caratan8.png;i_bagus_caratan8.ots.txt;i_bagus_caratan8.ann.txt;Amunapi Panjang puisi Bali Anyar? Ngantos magkin durung wenten watesan amunapi panjang lan pendek;Amunapi Panjang puisi Bali Anyar? Ngantos magkin durung wénten watesan amunapi panjang lan péndék
leak_pemoroan8.png;leak_pemoroan8.ots.txt;leak_pemoroan8.ann.txt;Banggayang iwang patute nibenin antuk tresnane tuna pikukuh tan prasida nemuang kayun;Banggayang iwang patuté nibénin antuk tresnané tuna pikukuh tan prasida nemuang kayun
Balinese_9.png;balinese_9_ots.txt;balinese_9_ann.txt;palayare sang lungha satdarurung milu Aryya Wiraraja wwang Madhura lyu ngi ring;palayare sang lungha satdarurung milu Arya Wiraraja wwang Madhura lyu ngi ring
i_bagus_caratan9.png;i_bagus_caratan9.ots.txt;i_bagus_caratan9.ann.txt;Meme mabalih wayang kanti ping telu.;Mémé mabalih wayang kanti ping telu.
leak_pemoroan9.png;leak_pemoroan9.ots.txt;leak_pemoroan9.ann.txt;Awig-Awig Desa Pakraman;Awig-Awig Desa Pakraman
Balinese_10.png;balinese_10_ots.txt;balinese_10_ann.txt;Meme ngalih don 50 (seket) papah.;Mémé ngalih don 50 (séket) papah.
i_bagus_caratan10.png;i_bagus_caratan10.ots.txt;i_bagus_caratan10.ann.txt;Apa sih zaena di Bedugul? ya lo ugelah pipis;Apa sih gaena di Bedugul? ya ko ngelah pipis
leak_pemoroan10.png;leak_pemoroan10.ots.txt;leak_pemoroan10.ann.txt;Dusase ento, ada blabar scde di Tejakula (Bulelenus).;Dugase ento, ada blabar gede di Tejakula (Buleleng).
Balinese_11.png;balinese_11_ots.txt;balinese_11_ann.txt;Suara Saking Bali;Suara Saking Bali
i_bagus_caratan11.png;i_bagus_caratan11.ots.txt;i_bagus_caratan11.ann.txt;NGAKAN MADE KASUB SIDAN:;NGAKAN MADE KASUB SIDAN:
leak_pemoroan11.png;leak_pemoroan11.ots.txt;leak_pemoroan11.ann.txt;sapramenake tri wangsa ne sami;sapramenake tri wangsa ne sami
Balinese_12.png;balinese_12_ots.txt;balinese_12_ann.txt;Meme mabalih wayang kanti ping telu;Mémé mabalih wayang kanti ping telu
i_bagus_caratan12.png;i_bagus_caratan12.ots.txt;i_bagus_caratan12.ann.txt;Aksara pangawit ring kruna arit ine- pih punika Q.;Aksara pangawit ring kruna arit ing- gih punika a.
leak_pemoroan12.png;leak_pemoroan12.ots.txt;leak_pemoroan12.ann.txt;miwah I Sanjya ngragani suba matulak tkede di nagari;miwah 1 Sanjya ngragani suba matulak thede di nagari
Balinese_13.png;balinese_13_ots.txt;balinese_13_ann.txt;Peteng Dedet Suwung Puyung;Peteng Dedet Suwung Puyung
i_bagus_caratan13.png;i_bagus_caratan13.ots.txt;i_bagus_caratan13.ann.txt;Koperasi patut ngangge badan hukum.;Koperasi patut nganggé badan hukum.
leak_pemoroan13.png;leak_pemoroan13.ots.txt;leak_pemoroan13.ann.txt;Ia ngelah celeng 25 (selae) ukud.;Ia ngelah céléng 25 (selaé) ukud,
Balinese_14.png;balinese_14_ots.txt;balinese_14_ann.txt;matuodun saombuk uyak ciclusanza;matundun sambuk uyak cici nganga
i_bagus_caratan14.png;i_bagus_caratan14.ots.txt;i_bagus_caratan14.ann.txt;san patut khaanesren sasuluh unat Hiudu.;san patut kaanggen sasuluh umat Hindu.
leak_pemoroan14.png;leak_pemoroan14.ots.txt;leak_pemoroan14.ann.txt;Wseopous welahans, da Ymabais be- bek. #;"Ngomong melahang, da ""mabais be- bek."""
Balinese_15.png;balinese_15_ots.txt;balinese_15_ann.txt;Jurnal Sastra Bali Modeeren;Jurnal Sastra Bali Modéren
i_bagus_caratan15.png;i_bagus_caratan15.ots.txt;i_bagus_caratan15.ann.txt;ddasdoon r;Dadong Raja
leak_pemoroan15.png;leak_pemoroan15.ots.txt;leak_pemoroan15.ann.txt;LE ee a i? , nn rena vy % ee av oF h y J 7 a. Ve {;I Raré Sigaran
Balinese_16.png;balinese_16_ots.txt;balinese_16_ann.txt;pamriksane mangde ka siddhan mamarggi pdasang sampunang nyaru;pamriksane mangde ka siddhan mamarggi pdasang sampunang nyaru
i_bagus_caratan16.png;i_bagus_caratan16.ots.txt;i_bagus_caratan16.ann.txt;Bapa suba dasa dina di Jakarta.;Bapa suba dasa dina di Jakarta.
leak_pemoroan16.png;leak_pemoroan16.ots.txt;leak_pemoroan16.ann.txt;Kenken, ke, kabare jani?;Kénkén, ké, kabaré jani?
Balinese_17.png;balinese_17_ots.txt;balinese_17_ann.txt;Lontar legarakertagana kakawi olih Prapanea.;Loutar Negarakertagama kakawi olih Prapanca.
i_bagus_caratan17.png;i_bagus_caratan17.ots.txt;i_bagus_caratan17.ann.txt;Bapa suba dasa dina di Jakarta.;Bapa suba dasa dina di Jakarta.
leak_pemoroan17.png;leak_pemoroan17.ots.txt;leak_pemoroan17.ann.txt;Rahayu, puja pangastiti aturang titiang majeng ring Ida Sang Hyang Widhi Wasa. santukan sangkaning asung kertha wara nugrahan Ida buku puniki prasida kamijilang tur mangkin sampun prasida kawacen olih ida dane makasami.;Rahayu, puja pangastiti aturang titiang majeng ring Ida Sang Hyang Widhi Wasa. santukan sangkaning asung kertha wara nugrahan Ida buku puniki prasida kamijilang tur mangkin sampun prasida kawacen olih ida dane makasami.
Balinese_18.png;balinese_18_ots.txt;balinese_18_ann.txt;"Puniki wantah utsaha saking Balai Bahasa Provinsi Bali nagingin kawentenan buku-buku sane kaanggen bahan bacaan literasi ring para janane, utamanyane ring jagat pendidikan. Ngwentenang buku anggen bahan bacaan wantah utsaha anggen nglimbakang iterasi. Ngwentenang bahan bacaan literasi sakadi satua mawiguna pisan anggen nincapang arsa ngwacen ring alit-alite miwah anggen numbuhang budi pekerti. Pinaka pahan utama anggen numbuhang karakter becik miwah pikayunan ngwaceen ring alit-alite patut kaupapira saking anom, punika kakawitin saking kulawarga, sekolah, kantos ring para janane. Pakarsan ngwacen sane akeh ring para janane, kasokong antuk kawentenan bahan bacaan sane becik miwah dangan kapolihang, pacang nincapang budaya ngwacen miwah nulis, inggin punika ring sekolah rauh ring para janane. Saking kawagedan antuk ngwacen puniki, iferasi dasar minakadi numerasi, sains, finansial, digital, miwah budaya prasida kaupapira tur kalimbakang. Metunyane buku puniki madue tetujon mangda dados piranti anggen ngukuhang miwah nyokong GLN Gerakan Literasi Nasional.
";"Puniki wantah utsaha saking Balai Bahasa Provinsi Bali nagingin kawentenan buku-buku sane kaanggen bahan bacaan literasi ring para janane, utamanyane ring jagat pendidikan. Ngwentenang buku anggen bahan bacaan wantah utsaha anggen nglimbakang literasi. Ngwentenang bahan bacaan literasi sakadi satua mawiguna pisan anggen nincapang arsa ngwacen ring alit-alite miwah anggen numbuhang budi pekerti. Pinaka pahan utama anggen numbuhang karakter becik miwah pikayunan ngwacen ring alit-alite patut kaupapira saking anom, punika kakawitin saking kulawarga, sekolah, kantos ring para janane. Pakarsan ngwacen sane akeh ring para janane, kasokong antuk kawentenan bahan bacaan sane becik miwah dangan kapolihang, pacang nincapang budaya ngwacen miwah nulis, inggih punika ring sekolah rauh ring para janane. Saking kawagedan antuk ngwacen puniki, literasi dasar minakadi numerasi, sains, finansial, digital, miwah budaya prasida kaupapira tur kalimbakang. Metunyane buku puniki madue tetujon mangda dados piranti anggen ngukuhang miwah nyokong GLN (Gerakan Literasi Nasional).
"
i_bagus_caratan18.png;i_bagus_caratan18.ots.txt;i_bagus_caratan18.ann.txt;"Salantumyanee, carita-carita sane kapupulang ring buku puniki prasida mawiguna pinaka silih tunggil sarana utawi media pendidikan karakter. Karaosang asapunika sawireh kawentenan carita punika akeh madue nilai-nilai adiluhung sane prasida ngemban fungsi praktis, inggih punika ngwangun karakter sang sane ngwaceen. Karakter sane kawangun wantah karakter religiositas, nasionalisme, kemadirian, gotong royong, miwah integritas. Tiosan ring punika, carita ring buku puniki kaaptiang prasida ngwangun imajinasi miwah kompetensi berpikir kritis, prasida numbuhang kreativitas miwah kaweruhan ring komunikasi kenten taler kolaborasi pinaka prasyarat ngamargiang kauripan ring abad 21.
";"Salantumyanee, carita-carita sane kapupulang ring buku puniki prasida mawiguna pinaka silih tunggil sarana utawi media pendidikan karakter. Karaosang asapunika sawireh kawentenan carita punika akeh madue nilai-nilai adiluhung sane prasida ngemban fungsi praktis, inggih punika ngwangun karakter sang sane ngwacen. Karakter sane kawangun wantah karakter religiositas, nasionalisme, kemadirian, gotong royong, miwah integritas. Tiosan ring punika, carita ring buku puniki kaaptiang prasida ngwangun imajinasi miwah kompetensi berpikir kritis, prasida numbuhang kreativitas miwah kaweruhan ring komunikasi kenten taler kolaborasi pinaka prasyarat ngamargiang kauripan ring abad 21.
"
leak_pemoroan18.png;leak_pemoroan18.ots.txt;leak_pemoroan18.ann.txt;"Buku puniki kamedalang pinaka jayanti saking acara Sayembara Penyusunan Bahan Bacaan Siswa SD Kelas Awal 1, 2, dan 3 nganggen dwibahasa utawi kalih basa, inggih punika naskah mabasa Indonesia miwah naskah mabasa Bali sane kasurat ring kalin buku. Indike punika nenten lempas saking utsaha pangawi Wayan Yogik Aditya Urdhahana miwah panyeleh wewacen utawi penyunting Ni Putu Ekatini Negari. Santukan punika titiang ngaturang paramaning suksma majeng ring pangawi kenten taler panyeleh wewacen miwah makasami sane sampun prasida ngwantu nyusun buku puniki. Mogi buku puniki prasida mawiguna pinaka jalaran numbuhang budaya iterasi miwah ngaturang aji kaweruhan ring para jananee nyujur insan Indonesia sane wikan, wicaksana, miwah madue budi pekerti luh ur.
";"Buku puniki kamedalang pinaka jayanti saking acara Sayembara Penyusunan Bahan Bacaan Siswa SD Kelas Awal (1, 2, dan 3) nganggen dwibahasa utawi kalih basa, inggih punika naskah mabasa Indonesia miwah naskah mabasa Bali sane kasurat ring kalih buku. Indike punika nenten lempas saking utsaha pangawi Wayan Yogik Aditya Urdhahana miwah panyeleh wewacen utawi penyunting Ni Putu Ekatini Negari. Santukan punika titiang ngaturang paramaning suksma majeng ring pangawi kenten taler panyeleh wewacen miwah makasami sane sampun prasida ngwantu nyusun buku puniki. Mogi buku puniki prasida mawiguna pinaka jalaran numbuhang budaya literasi miwah ngaturang aji kaweruhan ring para janane nyujur insan Indonesia sane wikan, wicaksana, miwah madue budi pekerti luhur.
"
Balinese_19.png;balinese_19_ots.txt;balinese_19_ann.txt;"Puja pangastuti aturang titiang majeng ring Ida Sang Hyang Widhi santukan sangkaning sih pasuweecan Ida, buku puniki prasida medal tur mangkin wenten ring tengahing kauripan alit-alit Indonesia sane kakasihin.
";"Puja pangastuti aturang titiang majeng ring Ida Sang Hyang Widhi santukan sangkaning sih pasuwecan Ida, buku puniki prasida medal tur mangkin wenten ring tengahing kauripan alit-alit Indonesia sane kakasihin.
"
i_bagus_caratan19.png;i_bagus_caratan19.ots.txt;i_bagus_caratan19.ann.txt;"Buku puniki nyaritayang sapunapi sang sane ngrereh genah kautaman punika patut mautsaha, nenten ja dangan ngrereh genah sane utama punika. Madaging carita mabela pati kantos ngamolihang genah sane utama utawi ngamolihang karahayuan.
";"Buku puniki nyaritayang sapunapi sang sane ngrereh genah kautaman punika patut mautsaha, nenten ja dangan ngrereh genah sane utama punika. Madaging carita mabela pati kantos ngamolihang genah sane utama utawi ngamolihang karahayuan.
"
leak_pemoroan19.png;leak_pemoroan19.ots.txt;leak_pemoroan19.ann.txt;"Ring buku puniki nyaritayang kawentenan anak alit saking Bali sane uripnyane setata lara, doh saking kawentenan arta brana napi malih kawentenan Bali sane kasengguh pulo sorga punika.
";"Ring buku puniki nyaritayang kawentenan anak alit saking Bali sane uripnyane setata lara, doh saking kawentenan arta brana napi malih kawentenan Bali sane kasengguh pulo sorga punika.
"
Balinese_20.png;balinese_20_ots.txt;balinese_20_ann.txt;"Ipun ngamolihang napi sane kaaptiang tur nyihnayang majeng ring jagate sami kawentenan kalaraan punika nenten patut kasalahang. Yening jagi ngrereh napi sane kaaptiang, punika patut mautsaha siling tunggilnyane ngruruh aji kaweruhan. Carita ring bukune puniki nyihnayang boya ja sane siteng sane utama, wantah sang sane mautsaha, seleg, teleb, miwah setata malajahang angga sane prasida jayanti ring kauripane.
";"Ipun ngamolihang napi sane kaaptiang tur nyihnayang majeng ring jagate sami kawentenan kalaraan punika nenten patut kasalahang. Yening jagi ngrereh napi sane kaaptiang, punika patut mautsaha siling tunggilnyane ngruruh aji kaweruhan. Carita ring bukune puniki nyihnayang boya ja sane siteng sane utama, wantah sang sane mautsaha, seleg, teleb, miwah setata malajahang angga sane prasida jayanti ring kauripane.
"
i_bagus_caratan20.png;i_bagus_caratan20.ots.txt;i_bagus_caratan20.ann.txt;"Carita anak alit sane doh saking arta brana nanging ring panguntatnyane prasida ngamolihang napi sane kaaptiang. Nenten wenten sane tan prasida karuruh yening iraga setata seleg malajah, teleb, tur mautsaha sane becik. Ngiring alit-alit mangda setata semangat. Wastu jaya anom yowananing Indonesia.
";"Carita anak alit sane doh saking arta brana nanging ring panguntatnyane prasida ngamolihang napi sane kaaptiang. Nenten wenten sane tan prasida karuruh yening iraga setata seleg malajah, teleb, tur mautsaha sane becik. Ngiring alit-alit mangda setata semangat. Wastu jaya anom yowananing Indonesia.
"
leak_pemoroan20.png;leak_pemoroan20.ots.txt;leak_pemoroan20.ann.txt;"Bagus Caratan tuah panak wong tani ane magoba caratan.
";"I Bagus Caratan tuah panak wong tani ane magoba caratan.
"
Balinese_21.png;balinese_21_ots.txt;balinese_21_ann.txt;"Ada tuturan satua anak makurenan, sawai-wai geginane tuah ngarap carik. la nongos di kubu ane tuduhan. Ane luh sedeng beling gede, mekenang nglekadang.

";"Ada tuturan satua anak makurenan, sawai-wai geginane tuah ngarap carik. Ia nongos di kubu ane tuduhan. Ane luh sedeng beling gede, mekenang nglekadang.

"
i_bagus_caratan21.png;i_bagus_caratan21.ots.txt;i_bagus_caratan21.ann.txt;"Lacur seken lacur, ia nglekadang panak magoba caratan. Caratane ento bisa ngomong cara anak muani. Munyine alus, matata budhi. Reramane sayang pesan tekening ia. Lantas ia kaadanin | Bagus Caratan.

";"Lacur seken lacur, ia nglekadang panak magoba caratan. Caratane ento bisa ngomong cara anak muani. Munyine alus, matata budhi. Reramane sayang pesan tekening ia. Lantas ia kaadanin I Bagus Caratan.

"
leak_pemoroan21.png;leak_pemoroan21.ots.txt;leak_pemoroan21.ann.txt;"Sawai-wai | Bagus Caratan nulungin reramane magae di carik. la ngaba yeh ane seger anggon inema teken reramane. la nyemak yeh di bulakan ane ada di tukad gede di samping carike.

";"Sawai-wai I Bagus Caratan nulungin reramane magae di carik. Ia ngaba yeh ane seger anggon inema teken reramane. Ia nyemak yeh di bulakan ane ada di tukad gede di samping carike.

"
Balinese_22.png;balinese_22_ots.txt;balinese_22_ann.txt;"Sedek dina anu | Bagus Caratan luas ka tukade lakar ngalih yeh di bulakan. Teked ditu yeh tukade gede. Krana baktine teken rerama, ia tusing ngitungang yeh tukad ane gede ento.

";"Sedek dina anu I Bagus Caratan luas ka tukade lakar ngalih yeh di bulakan. Teked ditu yeh tukade gede. Krana baktine teken rerama, ia tusing ngitungang yeh tukad ane gede ento.

"
i_bagus_caratan22.png;i_bagus_caratan22.ots.txt;i_bagus_caratan22.ann.txt;"Tusing karasa yeh tukade ngansan ngedenang, la anyud di tukade ento. la ngeling ngidih tulung. Reramane nyangjagin, nanging lacur la suba joh anyudang blabar.

";"Tusing karasa yeh tukade ngansan ngedenang, Ia anyud di tukade ento. Ia ngeling ngidih tulung. Reramane nyangjagin, nanging lacur la suba joh anyudang blabar.

"
leak_pemoroan22.png;leak_pemoroan22.ots.txt;leak_pemoroan22.ann.txt;"| Bagus Caratan takut, krana diarepne ada grobogan. Ditu ia ngacep nunas slamet ring Ida Bhatara. Rikala ulung ka grobogane saget ada empas ane nulungin ia. wee
";"I Bagus Caratan takut, krana diarepne ada grobogan. Ditu ia ngacep nunas slamet ring Ida Bhatara. Rikala ulung ka grobogane saget ada empas ane nulungin ia.
"
Balinese_23.png;balinese_23_ots.txt;balinese_23_ann.txt;"Empase ento tuah ane nguasayang tongose ditu. | Empas mapaica toya utama. Toya ane bisa dadi wisya miwah dadi tirta tamba. Pebesene apanga melah-melahang nganggon. Yening toya utama ento telah, krana tetujon jele sinah | Bagus Caratan lakar mati. Nanging yen anggon mayadnya mapitulung teken anak liu ia lakar idup lan bisa dadi manusa.
";"Empase ento tuah ane nguasayang tongose ditu. I Empas mapaica toya utama. Toya ane bisa dadi wisya miwah dadi tirta tamba. Pebesene apanga melah-melahang nganggon. Yening toya utama ento telah, krana tetujon jele sinah I Bagus Caratan lakar mati. Nanging yen anggon mayadnya mapitulung teken anak liu ia lakar idup lan bisa dadi manusa.
"
i_bagus_caratan23.png;i_bagus_caratan23.ots.txt;i_bagus_caratan23.ann.txt;"Kacerita jani di kedatuan, Sang Prabu sedeng sungsut kayun, santukan putrin idane kaengkebang olih | Raksasa. Raksasaneee ento nuba yeh semeer lan tukad ane ada ditu. Mawinan sami kramane pada gelem lan liu ane ngemasin mati.

";"Kacerita jani di kedatuan, Sang Prabu sedeng sungsut kayun, santukan putrin idane kaengkebang olih I Raksasa. Raksasane ento nuba yeh semeer lan tukad ane ada ditu. Mawinan sami kramane pada gelem lan liu ane ngemasin mati.

"
leak_pemoroan23.png;leak_pemoroan23.ots.txt;leak_pemoroan23.ann.txt;"| Bagus Caratan nepuk unduk di kedatuanee ento. la tengkejut krana ada anak ane nyemak awaknee. Ento tuah prajurit ane mekita nginem yeh. Krana caratane ento luung, abana ka kedatuan. r

";"I Bagus Caratan nepuk unduk di kedatuane ento. Ia tengkejut krana ada anak ane nyemak awakne. Ento tuah prajurit ane mekita nginem yeh. Krana caratane ento luung, abana ka kedatuan.

"
Balinese_24.png;balinese_24_ots.txt;balinese_24_ann.txt;"Neked di kedatuan ngenggalang ia ka tengah bale paruman. la matur ring Sang Prabu jagi mapitulung lakar nyegerang para krama ane kena grubug. Sang Prabu, Patih miwah Mantri sami tengkejut nyingakin ada caratan bisa ngomong.

";"Neked di kedatuan ngenggalang ia ka tengah bale paruman. Ia matur ring Sang Prabu jagi mapitulung lakar nyegerang para krama ane kena grubug. Sang Prabu, Patih miwah Mantri sami tengkejut nyingakin ada caratan bisa ngomong.

"
i_bagus_caratan24.png;i_bagus_caratan24.ots.txt;i_bagus_caratan24.ann.txt;"Sang Prabu ngicenin ia nambanin anak ane kena grubug. la suba nawang pasti pica toya utama ento lakar telah ditu lan lakar ngemasin mati. Nanging ia tusing ngitungang unduke ento, dikenehne tuah apang bisa mapitulung. ,

";"Sang Prabu ngicenin ia nambanin anak ane kena grubug. Ia suba nawang pasti pica toya utama ento lakar telah ditu lan lakar ngemasin mati. Nanging ia tusing ngitungang unduke ento, dikenehne tuah apang bisa mapitulung.

"
leak_pemoroan24.png;leak_pemoroan24.ots.txt;leak_pemoroan24.ann.txt;"Liu ane seger ulian | Bagus Caratan. Sang Prabu seneng raris malih nunas tulung nylametang Sang Putri ane _.. @ngkebanga teken | Raksasa. | Bagus Caratan sadia, raris majalan ka tongosne | Raksasa di Gook Lumbang. aa

";"Liu ane seger ulian I Bagus Caratan. Sang Prabu seneng raris malih nunas tulung nylametang Sang Putri ane engkebanga teken I Raksasa. I Bagus Caratan sadia, raris majalan ka tongosne I Raksasa di Gook Lumbang.

"
Balinese_25.png;balinese_25_ots.txt;balinese_25_ann.txt;"Neked di Gook Lumbang, | Bagus Caratan lan | Raksasa masiat. la nyemprotang toya wisya ka awakne | Raksasa. | Raksasa glalang-gliling aduh-aduh krana kena toya wisya tur ngemasin mati.

";"Neked di Gook Lumbang, I Bagus Caratan lan I Raksasa masiat. Ia nyemprotang toya wisya ka awakne I Raksasa. I Raksasa glalang-gliling aduh-aduh krana kena toya wisya tur ngemasin mati.

"
i_bagus_caratan25.png;i_bagus_caratan25.ots.txt;i_bagus_caratan25.ann.txt;"Krana pica toya utamane suba telah, | Bagus Caratan ngemasin mati. Sang Putri sedih ngatonang unduke ento. Nanging Ida tengkejut krana nyingakin awakne | Bagus Caratan ngendih pesu andus, raris magentos rupa dadi manusa tur idup malih.

";"Krana pica toya utamane suba telah, I Bagus Caratan ngemasin mati. Sang Putri sedih ngatonang unduke ento. Nanging Ida tengkejut krana nyingakin awakne I Bagus Caratan ngendih pesu andus, raris magentos rupa dadi manusa tur idup malih.

"
Balinese_26.png;balinese_26_ots.txt;balinese_26_ann.txt;"Sang Putri bagia tur prasida kacunduk malih sareng Ajin Idane. Kadatuanne prasida mawali rahayu. Pamuputne | Bagus Caratan kasandingang teken Sang Putri miwah kaadegang ratu ring Kadatuane punika.

";"Sang Putri bagia tur prasida kacunduk malih sareng Ajin Idane. Kadatuanne prasida mawali rahayu. Pamuputne I Bagus Caratan kasandingang teken Sang Putri miwah kaadegang ratu ring Kadatuane punika.

"
i_bagus_caratan26.png;i_bagus_caratan26.ots.txt;i_bagus_caratan26.ann.txt;"PITEKET SATUA lraga dados jadma patut saling tulungin, asih ring kauripan pakraman.

";"PITEKET SATUA Iraga dados jadma patut saling tulungin, asih ring kauripan pakraman.

"
Balinese_27.png;balinese_27_ots.txt;balinese_27_ann.txt;"Ajum-ajum Puwuh
";"Ajum-ajum Puwuh
"
Balinese_28.png;balinese_28_ots.txt;balinese_28_ann.txt;"Nang Lotok bengong mapangsegan negak ngelut entud palihatne nrawang sawa di durin pondokne. Carikne linggah pesan mara sajanalianga sekan mamula padi. Langite pelung kedas ngranang kalangen sakancanin jatmane ane ngiwasin sawireh pemandangane melah kadulurin ban angine ngasirsir. Di ambarane ambune putih kedas buka kapase pajlompot mapinda wayang lan beburonan. Kedis perit lan kedis bondole pasliwer marowang-rowangan pakeberne ngindang di duwur punyan padine ane suba kuning, sabilang jahan nyander ngenceg mapesta padi.
";"Nang Lotok bengong mapangsegan negak ngelut entud palihatne nrawang sawa di durin pondokne. Carikne linggah pesan mara sajan alianga sekan mamula padi. Langite pelung kedas ngranang kalangen sakancanin jatmane ane ngiwasin sawireh pemandangane melah kadulurin ban angine ngasirsir. Di ambarane ambune putih kedas buka kapase pajlompot mapinda wayang lan beburonan. Kedis perit lan kedis bondole pasliwer marowang-rowangan pakeberne ngindang di duwur punyan padine ane suba kuning, sabilang jahan nyander ngenceg mapesta padi.
"
